iri,label,entity1,entity1 label,entity2,entity2 label
UBERON:0004104,"hairline",UBERON:0000403,"scalp",UBERON:0008200,"forehead"
UBERON:0010222,"anatomical line between pupils",UBERON:0010223,"left pupil",UBERON:0010224,"right pupil"
UBERON:0010231,"anatomical line between outer ears",UBERON:0006616,"right external ear",UBERON:0006617,"left external ear"
UBERON:0011877,"margin of tongue",UBERON:0007371,"superior surface of tongue",UBERON:0007373,"inferior surface of tongue"
UBERON:0013455,"spheno-petrosal fissure",UBERON:0001677,"sphenoid bone",UBERON:0001694,"petrous part of temporal bone"
