iri,label,innervator,innervator label,innervatee,innervatee label,whole,whole label
UBERON:0006838,"ventral ramus of spinal nerve",UBERON:0001021,"nerve",UBERON:0008777,"hypaxial musculature",UBERON:0005476,"spinal nerve trunk"
UBERON:0006839,"dorsal ramus of spinal nerve",UBERON:0001021,"nerve",UBERON:0008778,"epaxial musculature",UBERON:0005476,"spinal nerve trunk"
UBERON:0008810,"nasopalatine nerve",UBERON:0001021,"nerve",UBERON:0005046,"mucosa of hard palate",UBERON:0000377,"maxillary nerve"
UBERON:0011315,"digastric branch of facial nerve",UBERON:0001021,"nerve",UBERON:0010944,"posterior digastric muscle",UBERON:0001647,"facial nerve"
UBERON:0011316,"nerve to stylohyoid from facial nerve",UBERON:0001021,"nerve",UBERON:0008712,"stylohyoid muscle",UBERON:0001647,"facial nerve"
UBERON:0011317,"nerve to stylopharyngeus from glossopharyngeal nerve",UBERON:0001021,"nerve",UBERON:0008804,"stylopharyngeus muscle",UBERON:0001649,"glossopharyngeal nerve"
UBERON:0022296,"inferior palpebral branch of infra-orbital nerve",UBERON:0001021,"nerve",UBERON:0001713,"lower eyelid",UBERON:0018408,"infra-orbital nerve"
UBERON:0022297,"palpebral branch of infra-orbital nerve",UBERON:0001021,"nerve",UBERON:0001711,"eyelid",UBERON:0018408,"infra-orbital nerve"
