http://purl.obolibrary.org/obo/UBERON_1200287	superior articular facet of third lumbar vertebra	A zone of bone organ forming the concave articular surface on the superior articular process of the third lumbar vertebra, oriented predominantly in the sagittal plane and facing medially. It articulates with the inferior articular facet of the second lumbar vertebra at the L2–L3 zygapophyseal joint, the most mobile segment in the mid-lumbar region.	UBERON:0005913	UBERON:0004619	https://fipat.library.dal.ca/ta2/|ISBN:9780323393225|Wikipedia:Lumbar_vertebrae	http://purl.obolibrary.org/obo/uberon/core#added_by_HRA	2026-03-19T00:00:00Z	https://orcid.org/0000-0002-7073-9172	http://purl.obolibrary.org/obo/NCBITaxon_9606
http://purl.obolibrary.org/obo/UBERON_1200288	superior articular facet of third thoracic vertebra	A zone of bone organ located on the superior articular process of the third thoracic vertebra, facing posteriorly and oriented in the coronal plane. It articulates with the inferior articular facet of T2 at the zygapophyseal joint, contributing to the stability and constrained mobility characteristic of the upper thoracic column.	UBERON:0005913	UBERON:0004628	https://fipat.library.dal.ca/ta2/|ISBN:9780323393225|Wikipedia:Thoracic_vertebrae	http://purl.obolibrary.org/obo/uberon/core#added_by_HRA	2026-03-19T00:00:00Z	https://orcid.org/0000-0002-7073-9172	http://purl.obolibrary.org/obo/NCBITaxon_9606
http://purl.obolibrary.org/obo/UBERON_1200289	superior articular facet of twelfth thoracic vertebra	A zone of bone organ located on the superior articular process of the twelfth thoracic vertebra, facing posteriorly and oriented in the coronal or slightly oblique plane. It articulates with the inferior articular facet of T11; T12 is markedly transitional and its superior facets retain the thoracic orientation while the inferior facets adopt the lumbar pattern.	UBERON:0005913	UBERON:0004636	https://fipat.library.dal.ca/ta2/|ISBN:9780323393225|Wikipedia:Thoracic_vertebrae	http://purl.obolibrary.org/obo/uberon/core#added_by_HRA	2026-03-19T00:00:00Z	https://orcid.org/0000-0002-7073-9172	http://purl.obolibrary.org/obo/NCBITaxon_9606
http://purl.obolibrary.org/obo/UBERON_1200290	superior articular process of first cervical vertebra	A process of vertebra forming the broad lateral mass of the atlas (C1) on its superior aspect, bearing the kidney-shaped concave facet that receives the occipital condyle to form the atlanto-occipital joint, enabling nodding movements of the head.	UBERON:0006061	UBERON:0001092	https://fipat.library.dal.ca/ta2/|ISBN:9780323393225|Wikipedia:Atlas_(anatomy)	http://purl.obolibrary.org/obo/uberon/core#added_by_HRA	2026-03-19T00:00:00Z	https://orcid.org/0000-0002-7073-9172	http://purl.obolibrary.org/obo/NCBITaxon_9606
http://purl.obolibrary.org/obo/UBERON_1200291	superior articular process of second cervical vertebra	A process of vertebra projecting laterally and superiorly from the body-pedicle junction of the axis (C2), bearing a flat oval articular facet that articulates with the inferior articular facet of the atlas; it is positioned anterior to the plane of the lower zygapophyseal joints.	UBERON:0006061	UBERON:0001093	https://fipat.library.dal.ca/ta2/|ISBN:9780323393225|Wikipedia:Axis_(anatomy)	http://purl.obolibrary.org/obo/uberon/core#added_by_HRA	2026-03-19T00:00:00Z	https://orcid.org/0000-0002-7073-9172	http://purl.obolibrary.org/obo/NCBITaxon_9606
http://purl.obolibrary.org/obo/UBERON_1200292	superior costal facet of eleventh thoracic vertebra	A zone of bone organ forming the superior demi-facet on the posterolateral body of the eleventh thoracic vertebra. It articulates with the head of rib 11; T11 typically bears a single large complete costal facet on the body for rib 11, which lacks a transverse costal facet on the transverse process, reflecting the atypical nature of this vertebra.	UBERON:0005913	UBERON:0004635	https://fipat.library.dal.ca/ta2/|ISBN:9780323393225|Wikipedia:Thoracic_vertebrae	http://purl.obolibrary.org/obo/uberon/core#added_by_HRA	2026-03-19T00:00:00Z	https://orcid.org/0000-0002-7073-9172	http://purl.obolibrary.org/obo/NCBITaxon_9606
http://purl.obolibrary.org/obo/UBERON_1200293	superior mental spine of mandible	A small skeletal element projection on the posterior surface of the mandibular symphysis forming the upper pair of genial tubercles, serving as the bilateral origin for the genioglossus muscles.	UBERON:4100000	UBERON:0001684	https://fipat.library.dal.ca/ta2/|ISBN:9780323393225|Wikipedia:Mandible	http://purl.obolibrary.org/obo/uberon/core#added_by_HRA	2026-03-19T00:00:00Z	https://orcid.org/0000-0002-7073-9172	http://purl.obolibrary.org/obo/NCBITaxon_9606
http://purl.obolibrary.org/obo/UBERON_1200294	superior nasal concha of ethmoid bone	A zone of bone organ forming the smallest and most superiorly placed nasal concha, projecting medially from the lateral mass of the ethmoid, bounding the superior meatus superiorly and directing inspired air toward the olfactory region.	UBERON:0005913	UBERON:0001679	https://fipat.library.dal.ca/ta2/|ISBN:9780323393225|Wikipedia:Ethmoid_bone	http://purl.obolibrary.org/obo/uberon/core#added_by_HRA	2026-03-19T00:00:00Z	https://orcid.org/0000-0002-7073-9172	http://purl.obolibrary.org/obo/NCBITaxon_9606
http://purl.obolibrary.org/obo/UBERON_1200295	superior nuchal line of squamous part of occipital bone	A zone of bone organ forming the upper of two curved ridges on the external surface of the squamous occipital bone, extending laterally from the external occipital protuberance. It provides attachment for the trapezius, sternocleidomastoid, and splenius capitis muscles.	UBERON:0005913	UBERON:0001676	https://fipat.library.dal.ca/ta2/|ISBN:9780323393225|Wikipedia:Occipital_bone	http://purl.obolibrary.org/obo/uberon/core#added_by_HRA	2026-03-19T00:00:00Z	https://orcid.org/0000-0002-7073-9172	http://purl.obolibrary.org/obo/NCBITaxon_9606
http://purl.obolibrary.org/obo/UBERON_1200296	superior orbital fissure of sphenoid bone	A bone foramen forming an elongated gap between the greater and lesser wings of the sphenoid bone at the apex of the orbit, connecting the middle cranial fossa to the orbital cavity; it transmits the oculomotor (CN III), trochlear (CN IV), abducens (CN VI), and ophthalmic (CN V1) nerves, as well as the superior ophthalmic vein.	UBERON:0005744	UBERON:0001677	https://fipat.library.dal.ca/ta2/|ISBN:9780323393225|Wikipedia:Sphenoid_bone	http://purl.obolibrary.org/obo/uberon/core#added_by_HRA	2026-03-19T00:00:00Z	https://orcid.org/0000-0002-7073-9172	http://purl.obolibrary.org/obo/NCBITaxon_9606
http://purl.obolibrary.org/obo/UBERON_1200297	superior pubic ramus of pubis of os coxa	A skeletal element projection forming the bar of bone extending superolaterally from the pubic body of the pubis of the os coxa (innominate bone), contributing to the anterior wall of the acetabulum and carrying on its superior edge the pecten pubis, which forms part of the pelvic brim.	UBERON:4100000	UBERON:0001272	https://fipat.library.dal.ca/ta2/|ISBN:9780323393225|Wikipedia:Hip_bone	http://purl.obolibrary.org/obo/uberon/core#added_by_HRA	2026-03-19T00:00:00Z	https://orcid.org/0000-0002-7073-9172	http://purl.obolibrary.org/obo/NCBITaxon_9606
http://purl.obolibrary.org/obo/UBERON_1200298	superior vertebral notch of first cervical vertebra	A bone foramen forming the superior indentation on the posterior aspect of the lateral mass of the atlas (C1), which when combined with the groove for the vertebral artery transmits the vertebral artery and the first cervical (suboccipital) nerve.	UBERON:0005744	UBERON:0001092	https://fipat.library.dal.ca/ta2/|ISBN:9780323393225|Wikipedia:Atlas_(anatomy)	http://purl.obolibrary.org/obo/uberon/core#added_by_HRA	2026-03-19T00:00:00Z	https://orcid.org/0000-0002-7073-9172	http://purl.obolibrary.org/obo/NCBITaxon_9606
http://purl.obolibrary.org/obo/UBERON_1200299	superior vertebral notch of second cervical vertebra	A bone foramen forming the superior indentation on the upper border of the pedicle of the axis (C2), which together with the inferior vertebral notch of the atlas contributes to the first cervical intervertebral foramen, transmitting the second cervical nerve.	UBERON:0005744	UBERON:0001093	https://fipat.library.dal.ca/ta2/|ISBN:9780323393225|Wikipedia:Axis_(anatomy)	http://purl.obolibrary.org/obo/uberon/core#added_by_HRA	2026-03-19T00:00:00Z	https://orcid.org/0000-0002-7073-9172	http://purl.obolibrary.org/obo/NCBITaxon_9606
http://purl.obolibrary.org/obo/UBERON_1200300	supinator fossa of ulna	A bone fossa forming the concave depression on the lateral aspect of the proximal ulna, just distal to the radial notch, providing the origin for the deep fibres of the supinator muscle.	UBERON:0004704	UBERON:0001424	https://fipat.library.dal.ca/ta2/|ISBN:9780323393225|Wikipedia:Ulna	http://purl.obolibrary.org/obo/uberon/core#added_by_HRA	2026-03-19T00:00:00Z	https://orcid.org/0000-0002-7073-9172	http://purl.obolibrary.org/obo/NCBITaxon_9606
http://purl.obolibrary.org/obo/UBERON_1200301	supraglenoid tubercle of scapula	A roughened skeletal element projection at the superior margin of the glenoid cavity of the scapula, serving as the origin of the long head of the biceps brachii muscle.	UBERON:4100000	UBERON:0006849	https://fipat.library.dal.ca/ta2/|ISBN:9780323393225|Wikipedia:Scapula	http://purl.obolibrary.org/obo/uberon/core#added_by_HRA	2026-03-19T00:00:00Z	https://orcid.org/0000-0002-7073-9172	http://purl.obolibrary.org/obo/NCBITaxon_9606
http://purl.obolibrary.org/obo/UBERON_1200302	supramastoid crest of squamous part of temporal bone	A crest forming a horizontal ridge on the outer surface of the squamous part of the temporal bone, running posteriorly from the root of the zygomatic process superior to the external auditory meatus. It represents the inferior margin of the temporal surface and serves as a landmark for the suprameatal triangle.	UBERON:4200133	UBERON:0001678	https://fipat.library.dal.ca/ta2/|ISBN:9780323393225|Wikipedia:Temporal_bone	http://purl.obolibrary.org/obo/uberon/core#added_by_HRA	2026-03-19T00:00:00Z	https://orcid.org/0000-0002-7073-9172	http://purl.obolibrary.org/obo/NCBITaxon_9606
http://purl.obolibrary.org/obo/UBERON_1200303	supraorbital notch or foramen of frontal bone	A bone foramen or notch in the supraorbital margin of the frontal bone, positioned approximately one-third of the way along the margin from its medial end. It transmits the supraorbital nerve and vessels to the forehead and scalp.	UBERON:0005744	UBERON:0000209	https://fipat.library.dal.ca/ta2/|ISBN:9780323393225|Wikipedia:Frontal_bone	http://purl.obolibrary.org/obo/uberon/core#added_by_HRA	2026-03-19T00:00:00Z	https://orcid.org/0000-0002-7073-9172	http://purl.obolibrary.org/obo/NCBITaxon_9606
http://purl.obolibrary.org/obo/UBERON_1200304	supraspinous fossa of scapula	A triangular bone fossa on the posterior surface of the scapula superior to the scapular spine, providing origin for the supraspinatus muscle, whose tendon passes beneath the coracoacromial arch to insert on the greater tubercle of the humerus.	UBERON:0004704	UBERON:0006849	https://fipat.library.dal.ca/ta2/|ISBN:9780323393225|Wikipedia:Scapula	http://purl.obolibrary.org/obo/uberon/core#added_by_HRA	2026-03-19T00:00:00Z	https://orcid.org/0000-0002-7073-9172	http://purl.obolibrary.org/obo/NCBITaxon_9606
http://purl.obolibrary.org/obo/UBERON_1200305	sustentaculum tali of calcaneus	A zone of bone organ forming a horizontal, shelf-like medial projection of the calcaneus that supports the head and neck of the talus. Its superior surface bears the middle talar articular facet, its inferior surface is grooved for the tendon of the flexor hallucis longus, and it provides attachment for the plantar calcaneonavicular and medial talocalcaneal ligaments.	UBERON:0005913	UBERON:0001450	https://fipat.library.dal.ca/ta2/|ISBN:9780323393225|Wikipedia:Calcaneus	http://purl.obolibrary.org/obo/uberon/core#added_by_HRA	2026-03-19T00:00:00Z	https://orcid.org/0000-0002-7073-9172	http://purl.obolibrary.org/obo/NCBITaxon_9606
http://purl.obolibrary.org/obo/UBERON_1200306	temporal fossa of parietal bone	A bone fossa forming a shallow concavity on the lateral surface of the parietal bone within the temporal region, bounded by the superior and inferior temporal lines. It constitutes the floor and posterior wall of the temporal fossa and provides the origin surface for the temporalis muscle.	UBERON:0004704	UBERON:0000210	https://fipat.library.dal.ca/ta2/|ISBN:9780323393225|Wikipedia:Parietal_bone	http://purl.obolibrary.org/obo/uberon/core#added_by_HRA	2026-03-19T00:00:00Z	https://orcid.org/0000-0002-7073-9172	http://purl.obolibrary.org/obo/NCBITaxon_9606
http://purl.obolibrary.org/obo/UBERON_1200307	tibial plateau of tibia	A zone of bone organ comprising the expanded proximal articular surface of the tibia, consisting of the medial and lateral condyles, which together form the superior articular surface of the knee joint. Each condyle bears a meniscus-covered articular facet that articulates with the corresponding femoral condyle, and the two condyles are separated by the intercondylar eminence.	UBERON:0005913	UBERON:0000979	https://fipat.library.dal.ca/ta2/|ISBN:9780323393225|Wikipedia:Tibia	http://purl.obolibrary.org/obo/uberon/core#added_by_HRA	2026-03-19T00:00:00Z	https://orcid.org/0000-0002-7073-9172	http://purl.obolibrary.org/obo/NCBITaxon_9606
http://purl.obolibrary.org/obo/UBERON_1200308	tibial tuberosity of tibia	A skeletal element projection forming the prominent oval eminence on the anterior surface of the proximal tibial shaft, located below the level of the tibial plateau and separated from it by the smooth patellar surface. It is the insertion site of the patellar ligament, transmitting the pull of the quadriceps femoris to extend the knee joint.	UBERON:4100000	UBERON:0000979	https://fipat.library.dal.ca/ta2/|ISBN:9780323393225|Wikipedia:Tibia	http://purl.obolibrary.org/obo/uberon/core#added_by_HRA	2026-03-19T00:00:00Z	https://orcid.org/0000-0002-7073-9172	http://purl.obolibrary.org/obo/NCBITaxon_9606
http://purl.obolibrary.org/obo/UBERON_1200309	transverse costal facet of eighth thoracic vertebra	A zone of bone organ located on the anterior surface of the transverse process of the eighth thoracic vertebra, articulating with the tubercle of the eighth rib at the costotransverse joint. The transverse processes are progressively shorter and more posteriorly directed at this level, and the facet is correspondingly reduced compared to those of upper thoracic vertebrae.	UBERON:0005913	UBERON:0011050	https://fipat.library.dal.ca/ta2/|ISBN:9780323393225|Wikipedia:Thoracic_vertebrae	http://purl.obolibrary.org/obo/uberon/core#added_by_HRA	2026-03-19T00:00:00Z	https://orcid.org/0000-0002-7073-9172	http://purl.obolibrary.org/obo/NCBITaxon_9606
http://purl.obolibrary.org/obo/UBERON_1200310	transverse costal facet of eleventh thoracic vertebra	A zone of bone organ located on the transverse process of the eleventh thoracic vertebra. T11 is atypical in that it generally lacks a true transverse costal facet, as rib 11 is a floating rib without a tubercular articulation at the transverse process; when present this facet is vestigial and clinically variable.	UBERON:0005913	UBERON:0004635	https://fipat.library.dal.ca/ta2/|ISBN:9780323393225|Wikipedia:Thoracic_vertebrae	http://purl.obolibrary.org/obo/uberon/core#added_by_HRA	2026-03-19T00:00:00Z	https://orcid.org/0000-0002-7073-9172	http://purl.obolibrary.org/obo/NCBITaxon_9606
http://purl.obolibrary.org/obo/UBERON_1200311	transverse costal facet of fifth thoracic vertebra	A zone of bone organ located on the anterior surface of the transverse process of the fifth thoracic vertebra, articulating with the tubercle of the fifth rib at the costotransverse joint. As thoracic vertebrae descend, the transverse process shortens and its costal facet becomes relatively smaller, though it remains distinct at T5.	UBERON:0005913	UBERON:0004630	https://fipat.library.dal.ca/ta2/|ISBN:9780323393225|Wikipedia:Thoracic_vertebrae	http://purl.obolibrary.org/obo/uberon/core#added_by_HRA	2026-03-19T00:00:00Z	https://orcid.org/0000-0002-7073-9172	http://purl.obolibrary.org/obo/NCBITaxon_9606
http://purl.obolibrary.org/obo/UBERON_1200312	transverse costal facet of first thoracic vertebra	A zone of bone organ located on the anterior surface of the transverse process of the first thoracic vertebra, articulating with the tubercle of the first rib at the costotransverse joint. T1 has well-developed transverse processes with distinct transverse costal facets that, together with the costal facets of the body, contribute to the firm articulation supporting the first rib.	UBERON:0005913	UBERON:0004626	https://fipat.library.dal.ca/ta2/|ISBN:9780323393225|Wikipedia:Thoracic_vertebrae	http://purl.obolibrary.org/obo/uberon/core#added_by_HRA	2026-03-19T00:00:00Z	https://orcid.org/0000-0002-7073-9172	http://purl.obolibrary.org/obo/NCBITaxon_9606
http://purl.obolibrary.org/obo/UBERON_1200313	transverse costal facet of fourth thoracic vertebra	A zone of bone organ located on the anterior surface of the transverse process of the fourth thoracic vertebra, presenting as a smooth concave articular area that articulates with the tubercle of the fourth rib at the costotransverse joint. Together with the body demifacets it completes the bony articulation of rib 4 with the thoracic column.	UBERON:0005913	UBERON:0004629	https://fipat.library.dal.ca/ta2/|ISBN:9780323393225|Wikipedia:Thoracic_vertebrae	http://purl.obolibrary.org/obo/uberon/core#added_by_HRA	2026-03-19T00:00:00Z	https://orcid.org/0000-0002-7073-9172	http://purl.obolibrary.org/obo/NCBITaxon_9606
http://purl.obolibrary.org/obo/UBERON_1200314	transverse costal facet of ninth thoracic vertebra	A zone of bone organ located on the anterior surface of the transverse process of the ninth thoracic vertebra, articulating with the tubercle of the ninth rib at the costotransverse joint. T9 represents the lower limit of the typical transverse costal facet pattern; below this level the transverse processes diminish and the facets become vestigial or absent.	UBERON:0005913	UBERON:0004633	https://fipat.library.dal.ca/ta2/|ISBN:9780323393225|Wikipedia:Thoracic_vertebrae	http://purl.obolibrary.org/obo/uberon/core#added_by_HRA	2026-03-19T00:00:00Z	https://orcid.org/0000-0002-7073-9172	http://purl.obolibrary.org/obo/NCBITaxon_9606
http://purl.obolibrary.org/obo/UBERON_1200315	transverse costal facet of second thoracic vertebra	A zone of bone organ located on the anterior surface of the transverse process of the second thoracic vertebra, presenting as a smooth oval articular area that articulates with the tubercle of the second rib at the costotransverse joint. This facet, together with the demifacets on the vertebral body, anchors the second rib to the thoracic column.	UBERON:0005913	UBERON:0004627	https://fipat.library.dal.ca/ta2/|ISBN:9780323393225|Wikipedia:Thoracic_vertebrae	http://purl.obolibrary.org/obo/uberon/core#added_by_HRA	2026-03-19T00:00:00Z	https://orcid.org/0000-0002-7073-9172	http://purl.obolibrary.org/obo/NCBITaxon_9606
http://purl.obolibrary.org/obo/UBERON_1200316	transverse costal facet of seventh thoracic vertebra	A zone of bone organ located on the anterior surface of the transverse process of the seventh thoracic vertebra, articulating with the tubercle of the seventh rib at the costotransverse joint. The transverse processes decrease in length inferiorly through the thoracic series, and the facet at T7 is smaller than those of the upper thoracic vertebrae.	UBERON:0005913	UBERON:0004632	https://fipat.library.dal.ca/ta2/|ISBN:9780323393225|Wikipedia:Thoracic_vertebrae	http://purl.obolibrary.org/obo/uberon/core#added_by_HRA	2026-03-19T00:00:00Z	https://orcid.org/0000-0002-7073-9172	http://purl.obolibrary.org/obo/NCBITaxon_9606
http://purl.obolibrary.org/obo/UBERON_1200317	transverse costal facet of sixth thoracic vertebra	A zone of bone organ located on the anterior surface of the transverse process of the sixth thoracic vertebra, articulating with the tubercle of the sixth rib at the costotransverse joint. It is a smooth, oval synovial articular area that guides rib rotation during breathing and contributes to thoracic cage stability.	UBERON:0005913	UBERON:0004631	https://fipat.library.dal.ca/ta2/|ISBN:9780323393225|Wikipedia:Thoracic_vertebrae	http://purl.obolibrary.org/obo/uberon/core#added_by_HRA	2026-03-19T00:00:00Z	https://orcid.org/0000-0002-7073-9172	http://purl.obolibrary.org/obo/NCBITaxon_9606
http://purl.obolibrary.org/obo/UBERON_1200318	transverse costal facet of tenth thoracic vertebra	A zone of bone organ located on the anterior surface of the transverse process of the tenth thoracic vertebra, articulating with the tubercle of the tenth rib at the costotransverse joint. T10 bears a transverse costal facet, though it is variably developed; the single complete costal facet on its body accommodates the head of the tenth rib.	UBERON:0005913	UBERON:0004634	https://fipat.library.dal.ca/ta2/|ISBN:9780323393225|Wikipedia:Thoracic_vertebrae	http://purl.obolibrary.org/obo/uberon/core#added_by_HRA	2026-03-19T00:00:00Z	https://orcid.org/0000-0002-7073-9172	http://purl.obolibrary.org/obo/NCBITaxon_9606
http://purl.obolibrary.org/obo/UBERON_1200319	transverse costal facet of third thoracic vertebra	A zone of bone organ located on the anterior surface of the transverse process of the third thoracic vertebra, articulating with the tubercle of the third rib at the costotransverse joint. It forms one component of the paired costovertebral articulations that stabilize and guide rib movement during respiration.	UBERON:0005913	UBERON:0004628	https://fipat.library.dal.ca/ta2/|ISBN:9780323393225|Wikipedia:Thoracic_vertebrae	http://purl.obolibrary.org/obo/uberon/core#added_by_HRA	2026-03-19T00:00:00Z	https://orcid.org/0000-0002-7073-9172	http://purl.obolibrary.org/obo/NCBITaxon_9606
http://purl.obolibrary.org/obo/UBERON_1200320	transverse foramen of first cervical vertebra	A bone foramen piercing the transverse process of the atlas (C1) and typically transmitting the vertebral artery, vertebral vein, and sympathetic plexus; it is characteristically large compared with lower cervical vertebrae, reflecting the broad transverse processes of the atlas.	UBERON:0005744	UBERON:0001092	https://fipat.library.dal.ca/ta2/|ISBN:9780323393225|Wikipedia:Atlas_(anatomy)	http://purl.obolibrary.org/obo/uberon/core#added_by_HRA	2026-03-19T00:00:00Z	https://orcid.org/0000-0002-7073-9172	http://purl.obolibrary.org/obo/NCBITaxon_9606
http://purl.obolibrary.org/obo/UBERON_1200321	transverse foramen of second cervical vertebra	A bone foramen piercing the root of the transverse process of the axis (C2), transmitting the vertebral artery, vertebral vein, and accompanying sympathetic plexus on their ascent toward the foramen magnum; it is directed superolaterally.	UBERON:0005744	UBERON:0001093	https://fipat.library.dal.ca/ta2/|ISBN:9780323393225|Wikipedia:Axis_(anatomy)	http://purl.obolibrary.org/obo/uberon/core#added_by_HRA	2026-03-19T00:00:00Z	https://orcid.org/0000-0002-7073-9172	http://purl.obolibrary.org/obo/NCBITaxon_9606
http://purl.obolibrary.org/obo/UBERON_1200322	transverse process of coccyx	A transverse process of vertebra arising from the lateral surface of the first coccygeal segment as a small, rudimentary lateral projection that provides attachment for the coccygeus muscle and the anococcygeal ligament, representing a vestigial homologue of the transverse processes of free vertebrae.	UBERON:0001077	UBERON:0001350	https://fipat.library.dal.ca/ta2/|ISBN:9780323393225|Wikipedia:Coccyx	http://purl.obolibrary.org/obo/uberon/core#added_by_HRA	2026-03-19T00:00:00Z	https://orcid.org/0000-0002-7073-9172	http://purl.obolibrary.org/obo/NCBITaxon_9606
http://purl.obolibrary.org/obo/UBERON_1200323	transverse process of first cervical vertebra	A transverse process of vertebra projecting broadly and laterally from the lateral mass of the atlas (C1), longer than those of other cervical vertebrae and lacking a bifid tip; it serves as attachment for several muscles controlling head rotation and lateral flexion, and is palpable between the mastoid process and the mandibular angle.	UBERON:0001077	UBERON:0001092	https://fipat.library.dal.ca/ta2/|ISBN:9780323393225|Wikipedia:Atlas_(anatomy)	http://purl.obolibrary.org/obo/uberon/core#added_by_HRA	2026-03-19T00:00:00Z	https://orcid.org/0000-0002-7073-9172	http://purl.obolibrary.org/obo/NCBITaxon_9606
http://purl.obolibrary.org/obo/UBERON_1200324	transverse process of second cervical vertebra	A transverse process of vertebra projecting laterally from the vertebral arch of the axis (C2), bearing the transverse foramen for the vertebral artery and providing attachment for the inferior oblique capitis, levator scapulae, and scalenus medius muscles.	UBERON:0001077	UBERON:0001093	https://fipat.library.dal.ca/ta2/|ISBN:9780323393225|Wikipedia:Axis_(anatomy)	http://purl.obolibrary.org/obo/uberon/core#added_by_HRA	2026-03-19T00:00:00Z	https://orcid.org/0000-0002-7073-9172	http://purl.obolibrary.org/obo/NCBITaxon_9606
http://purl.obolibrary.org/obo/UBERON_1200325	transverse ridges of sternum	A zone of bone organ comprising the low, horizontal bony ridges on the anterior surface of the sternal body that mark the lines of fusion between adjacent sternebrae during development, typically three ridges dividing the body into four segments and remaining palpable on the adult sternum.	UBERON:0005913	UBERON:0000975	https://fipat.library.dal.ca/ta2/|ISBN:9780323393225|Wikipedia:Sternum	http://purl.obolibrary.org/obo/uberon/core#added_by_HRA	2026-03-19T00:00:00Z	https://orcid.org/0000-0002-7073-9172	http://purl.obolibrary.org/obo/NCBITaxon_9606
